{
  "market": "singapore_malaysia",
  "companies": [
    {
      "name": "Aonic",
      "country": "Malaysia",
      "what_they_ship": "Agriculture drones, drone spraying services, Airamap Desktop for aerial analysis, MIST Flight App for mission automation, and Agriculture App for farmer services.",
      "imagery_classes_used": [
        "drone",
        "aerial_mapping",
        "plantation_mapping",
        "geospatial_vectors"
      ],
      "hiring_for": [
        "Software Engineer for desktop agricultural mapping software, AI backend integration, tree detection, Leaflet, GeoJSON and shapefiles",
        "Software Intern",
        "UAS Remote Pilot and UAS Maintenance Technician for agricultural drones"
      ],
      "hiring_evidence": [
        {
          "url": "https://my.linkedin.com/jobs/view/software-engineer-at-aonic-4424610474",
          "date": "2026-07",
          "title": "Software Engineer at Aonic",
          "tier": "B",
          "note": "LinkedIn listing says role develops desktop mapping software used in agricultural environments and integrates AI tree-detection APIs."
        },
        {
          "url": "https://careers.aonic.com/",
          "date": "2026-09",
          "title": "Careers in drone industry - Aonic",
          "tier": "A",
          "note": "Careers page lists agricultural drone pilots, maintenance technicians, autonomous systems and software roles."
        }
      ],
      "evidence": [
        {
          "url": "https://aonic.com/my/agriculture/proprietary-software/",
          "date": "2026",
          "title": "Proprietary Software - Aonic Malaysia",
          "tier": "A",
          "note": "Official product page describes intelligent drone flight control, AI-driven plantation mapping, Airamap, Agriculture App and MIST Flight App."
        },
        {
          "url": "https://aonic.com/my/our-story/",
          "date": "2025-09",
          "title": "Our Story - Aonic Malaysia",
          "tier": "A",
          "note": "Official milestone page says Aonic launched Mist Tec 50, a locally engineered 50-litre agricultural drone, in September 2025."
        },
        {
          "url": "https://resource.aonic.com/event/maha-2026/",
          "date": "2026-08-28",
          "title": "MAHA 2026 - Aonic Resource Hub",
          "tier": "A",
          "note": "Aonic promoted latest agriculture drone technologies and smart farming solutions at MAHA 2026."
        }
      ],
      "fresher_fyp_should_signal": "Build field-ready geospatial software: robust orthomosaic/vector workflows, tree or stress detection, low-connectivity sync, and clean handoff from map insight to drone mission.",
      "do_not_compete_here": false
    },
    {
      "name": "Meraque",
      "country": "Malaysia",
      "what_they_ship": "PASS precision-agriculture software, SPACE hybrid agricultural spraying drones, UAV and AGV fleet management, crop health monitoring, and plantation intelligence dashboards.",
      "imagery_classes_used": [
        "drone",
        "multispectral_imaging",
        "plantation_dashboard",
        "uav_telemetry",
        "agv_telemetry"
      ],
      "hiring_for": [
        "Technical Product Lead / Solution Architect for drone and robotics systems",
        "Head of Technology Robotics covering UAV, AGV, autonomy software, AI/ML, SaaS and edge-cloud systems",
        "Robotics Deployment Engineer for AGV field deployment"
      ],
      "hiring_evidence": [
        {
          "url": "https://my.linkedin.com/jobs/view/technical-product-lead-drone-robotics-at-meraque-my-4462964407",
          "date": "2026-09-13",
          "title": "Technical Product Lead (Drone & Robotics) at Meraque MY",
          "tier": "B",
          "note": "Fresh listing seeks solution architecture, PoCs, cloud/edge/backend/frontend integration and robotics telemetry dashboards."
        },
        {
          "url": "https://my.linkedin.com/jobs/view/head-of-technology-robotic-uav-agv-at-meraque-my-4383293891",
          "date": "2026-04",
          "title": "Head of Technology Robotic (UAV & AGV) at Meraque MY",
          "tier": "B",
          "note": "Listing covers UAV, AGV, robot autonomy software, AI/ML, SaaS and edge-cloud systems."
        },
        {
          "url": "https://my.linkedin.com/jobs/view/robotics-deployment-engineer-ardupilot-expertise-at-meraque-my-4405923525",
          "date": "2026-06",
          "title": "Robotics Deployment Engineer - ArduPilot Expertise at Meraque MY",
          "tier": "B",
          "note": "Role focuses on commissioning AGV rovers in agricultural and industrial environments."
        }
      ],
      "evidence": [
        {
          "url": "https://meraque.ai/industry/agriculture-plantation/",
          "date": "2026",
          "title": "Agriculture and Plantation - Meraque Group",
          "tier": "A",
          "note": "Official page lists drone spraying, crop health monitoring with multispectral imaging and AI analytics, AGV operations, and virtual replanting blueprint design."
        },
        {
          "url": "https://meraque.ai/precision-agriculture-software-solution/",
          "date": "2026",
          "title": "Precision Agriculture Software Solution (PASS)",
          "tier": "A",
          "note": "Official page describes PASS as a platform for drone spraying, fleet management, robot analytics and plantation intelligence."
        },
        {
          "url": "https://www.linkedin.com/posts/meraque-my_meraque-hybriddrone-dronetechnology-activity-7475764318014287872-9Wnx",
          "date": "2026-06-25",
          "title": "Meraque hybrid drone MAEPS demonstration",
          "tier": "B",
          "note": "Meraque promoted live demonstrations of its hybrid agricultural drone at MAEPS on 25-26 June 2026."
        }
      ],
      "fresher_fyp_should_signal": "Show robotics-software integration under plantation constraints: telemetry, mission planning, map-derived actions, validation against field images, and graceful offline operation.",
      "do_not_compete_here": false
    },
    {
      "name": "Aerodyne",
      "country": "Malaysia",
      "what_they_ship": "Agrimor SuperApp for precision agriculture services, letting farmers and agencies request drone pilots for seeding, spraying, plant analysis and mapping.",
      "imagery_classes_used": [
        "drone",
        "aerial_mapping",
        "plant_analysis",
        "uav_service_marketplace"
      ],
      "hiring_for": [],
      "hiring_evidence": [],
      "evidence": [
        {
          "url": "https://aerodyne.group/agrimor.html",
          "date": "2026",
          "title": "Agrimor - Aerodyne",
          "tier": "A",
          "note": "Official page describes Agrimor as a precision agriculture SuperApp for drones, pilots, seeding, spraying, plant analysis and mapping."
        },
        {
          "url": "https://aerodyne.group/people.html",
          "date": "2026",
          "title": "Our People - Aerodyne Group",
          "tier": "A",
          "note": "Careers page says Aerodyne is a UAS-based managed services company and accepts graduate/internship interest."
        }
      ],
      "fresher_fyp_should_signal": "Signal service-scale reliability: converting aerial surveys into operational requests, QC for pilot-collected imagery, and measurable improvement in mapping or plant-analysis turnaround.",
      "do_not_compete_here": false
    },
    {
      "name": "Agrispec",
      "country": "Malaysia",
      "what_they_ship": "XAG agricultural drones and accessories for spraying, seeding, RTK-guided autonomous operation, obstacle avoidance, mapping and offline/online map stitching.",
      "imagery_classes_used": [
        "drone",
        "rtk_mapping",
        "aerial_orthomosaic",
        "spray_prescription"
      ],
      "hiring_for": [],
      "hiring_evidence": [],
      "evidence": [
        {
          "url": "https://www.agrispec.com.my/v50",
          "date": "2026",
          "title": "XAG V50 Drone - XAG Agrispec",
          "tier": "A",
          "note": "Official Malaysia distributor page describes autonomous agricultural mapping, RTK navigation, spraying, seeding and HD map stitching."
        }
      ],
      "fresher_fyp_should_signal": "Build around operator workflows: precise boundary extraction, prescription-map generation, spray/seeding route QA, and uncertainty flags for maps made by one-person drone teams.",
      "do_not_compete_here": false
    },
    {
      "name": "Polybee",
      "country": "Singapore",
      "what_they_ship": "Farm Intelligence Platform using autonomous drones and AI for yield forecasting, row-level harvest readiness, harvest optimization and autonomous pollination.",
      "imagery_classes_used": [
        "drone",
        "micro_drone",
        "high_resolution_rgb",
        "computer_vision",
        "protected_horticulture"
      ],
      "hiring_for": [
        "Senior Computer Vision Engineer",
        "Customer Success & Growth Manager for field deployments and grower onboarding"
      ],
      "hiring_evidence": [
        {
          "url": "https://sg.linkedin.com/jobs/view/senior-computer-vision-engineer-at-polybee-4325264260",
          "date": "2026-03",
          "title": "Senior Computer Vision Engineer at Polybee",
          "tier": "B",
          "note": "Listing asks for deep-learning models that detect, segment and extract insights from drone imagery."
        },
        {
          "url": "https://sg.linkedin.com/company/polybee",
          "date": "2026-06",
          "title": "Polybee LinkedIn company updates",
          "tier": "B",
          "note": "Company update advertises Customer Success & Growth Manager for grower field deployments and onboarding."
        }
      ],
      "evidence": [
        {
          "url": "https://www.polybee.co/product",
          "date": "2026",
          "title": "Product - Polybee",
          "tier": "A",